{
  "$schema": "../../schemas/evm-chain.schema.json",
  "id": 80001,
  "network": "maticmum",
  "name": "Polygon Mumbai",
  "nativeCurrency": {
    "name": "MATIC",
    "symbol": "MATIC",
    "decimals": 18,
    "iconUrl": "/images/tokens/matic.svg"
  },
  "rpcUrls": ["https://matic-mumbai.chainstacklabs.com"],
  "blockExplorers": [
    {
      "name": "PolygonScan",
      "url": "https://mumbai.polygonscan.com"
    }
  ],
  "iconUrl": "/images/chains/polygon.svg",
  "testnet": true
}
